,FID_1,ProjectNo,Dist,AddMPOName,IDENTIFIER,IDENTIFI_1,DESC_,PROJTYPE,ESTIMPRVAS,ROUTEORDER,TYCOUNTYDI,Routeuniqu,BEGINNINGM,ENDINGMILE,TYROUTENAM,EEC_Intersection,ProjectN_1,Roadway_EEC,Final_EEC
358,80,359,4,Elizabethtown-Radcliff MPO,IP20150340,4-154,IMPROVE MOBILITY AND REDUCE CONGESTION ON US-31W FROM US-31WB TO CS-2255 (WILSON ROAD). (10CCR)(12CCR),CONGESTION MITIGTN(O),Auxiliary Lanes or Operation Improvements,1,Hardin,047-US-0031  -000,18.817999999999998,28.4,Existing,0.0,0,0.0,0.0
338,343,339,4,Elizabethtown-Radcliff MPO,IP20090011,,REALIGNMENT OF SOUTH WILSON ROAD IN RADCLIFF TO CREATE A NEW INTERSECTION WITH THE NORTH WILSON ROAD REALIGNMENT AT WEST LINCOLN TRAIL BLVD,New Route,Improve Intersection,2,Hardin,047-PF-9999  -000,0.0,0.0,Proposed,0.0,0,0.0,0.0
76,233,77,1,Pennyrile ADD,IP20160149,Jan-51,REALIGN KY 124 APPROACH TO KY 139 TO IMPROVE INTERSECTION ANGLE AND SIGHT DISTANCE. (16CCN)(18CCN),AIR QUALITY(P),Improve Intersection,2,Trigg,111-PF-9999  -000,0.0,0.0,Proposed,0.0,0,0.0,0.0
78,304,79,1,Purchase ADD,IP20170075,,"Address condition, access and future congestion issues from approx 1 mile north of Wickliffe to Ohio River Bridge.(Section L - 1993 Scoping Study)",Relocation,2 Lane to 4 Lane Divided - Rural,2,Ballard,004-PF-9999  -000,0.0,0.0,Proposed,0.0,0,0.0,0.0
81,64,82,1,Purchase ADD,IP20190023,,Reconstruct intersection of US 641 S and KY 58.,Spot Improvement,,999,Marshall,079-US-0641  -000,2.7969999999999997,2.897,Approach,0.0,0,0.0,0.0
82,403,83,1,Purchase ADD,IP20190023,,Reconstruct intersection of US 641 S and KY 58.,Spot Improvement,,999,Marshall,079-US-0641  -000,2.897,2.989,Approach,0.0,0,0.0,0.0
83,265,84,1,Purchase ADD,IP20190023,,Reconstruct intersection of US 641 S and KY 58.,Spot Improvement,,999,Marshall,079-US-0641  -010,2.799,2.8989999999999996,Approach,0.0,0,0.0,0.0
84,12,85,1,Purchase ADD,IP20190023,,Reconstruct intersection of US 641 S and KY 58.,Spot Improvement,,999,Marshall,079-US-0641  -010,2.8989999999999996,2.989,Approach,0.0,0,0.0,0.0
56,344,57,1,Purchase ADD,IP20120084,,"Improve mobility, address geometric deficiencies, and reduce congestion along Brinn Rd (CR1401) between KY 80 and  Utterback Road (CR1552) in Murray.",Minor Widening,Modernize Roadway-Rural,3,Calloway,018-CS-1354  -000,0.0,0.19699999999999998,Existing,0.0,57,0.0,0.0
55,281,56,1,Purchase ADD,IP20120084,,"Improve mobility, address geometric deficiencies, and reduce congestion along Brinn Rd (CR1401) between KY 80 and  Utterback Road (CR1552) in Murray.",Minor Widening,Modernize Roadway-Rural,2,Calloway,018-CR-1401  -000,1.1320000000000001,1.837,Existing,0.0,56,0.0,0.0
333,210,334,4,Lincoln Trail ADD,IP20080737,,CONSTRUCT SOUTHEASTERN LEBANON BYPASS FROM INDUSTRIAL DRIVE TO US 68 AT KY 2154.  ESTIMATED TOTAL LENGTH: 3.5 MILES.,Bypass,Construct Road in New Location,2,Marion,078-PF-9999  -000,0.0,0.0,Proposed,0.0,0,0.0,0.0
304,293,305,4,Lincoln Trail ADD,IP20050037,,EXTEND WAREHOUSE ROAD TO KY 2154 (LEBANON BYPASS).  ESTIMATED TOTAL LENGTH: 0.8 MILES.,Reconstruction,Local Roadway Improvements,1,Marion,078-CS-1091  -000,0.35,0.37,Existing,0.0,0,0.0,0.0
361,368,362,4,Lincoln Trail ADD,IP20150384,9-Apr,NEW ROUTE BETWEEN US 62 AND KY 245 WEST OF BARDSTOWN. (16CCR)(18CCN),NEW ROUTE(O),Construct Road in New Location,2,Nelson,090-PF-9999  -000,0.0,0.0,Proposed,0.0,0,0.0,0.0
360,209,361,4,Lincoln Trail ADD,IP20150384,9-Apr,NEW ROUTE BETWEEN US 62 AND KY 245 WEST OF BARDSTOWN. (16CCR)(18CCN),NEW ROUTE(O),Construct Road in New Location,1,Nelson,090-US-0031  -000,12.2,16.7,Existing,0.0,0,0.0,0.0
456,620,457,5,KIPDA ADD,IP20150424,5-475,WIDEN I-64 TO SIX LANES FROM KY 53 IN SHELBYVILLE TO KY 1790 UNDERPASS.,SAFETY(P),Add Lane to Full Control Facility,1,Shelby,106-I-0064  -000,35.163000000000004,38.122,Existing,0.0,0,0.0,0.0
323,201,324,4,Barren River ADD,IP20070182,,WIDEN TO 3 LANES FROM GUTHRIE STREET IN HORSE CAVE TO SOUTH OF CAVERNA HIGH SCHOOL. EXCLUDES HES PROJECT.,Minor Widening,Install Two-way Left Turn Lane,1,Hart,050-US-0031  -000,0.05,2.875,Existing,0.0,0,0.0,0.0
112,110,113,2,Pennyrile ADD,IP20070010,,I69- RECONSTRUCT INTERCHANGE AT KY 91 IN PRINCETON,Reconstruction,Improve Intersection,1,Caldwell,017-I-0069  -000,79.51899999999999,79.949,Existing,0.0,0,0.0,0.0
113,243,114,2,Clarksville-Oak Grove MPO,IP20070011,,Improve Safety and reduce congestion on I 24 from US 41A to Kentucky/Tennessee state line.,Major Widening,Add Lane to Full Control Facility,1,Christian,024-I-0024  -000,85.56299999999999,93.37299999999999,Existing,0.0,0,0.0,0.0
119,413,120,2,Clarksville-Oak Grove MPO,IP20070039,,Improve access and reduce congestion from US 41A to KY 115 by construction a new route from Gate 4/US 41A to KY 115.      This project was formerly PIF  024 C000010.0,New Route,Other Improvement Types,1,Christian,024-PF-9999  -000,0.0,0.0,Proposed,0.0,0,0.0,0.0
445,624,446,5,Louisville-Southern Indiana (KIPDA) MPO,IP20150266,5-48.10,"ADDITION OF NB AND SB AUXILIARY LANES ON I-71 NEAR KENNEDY, INCLUDING OPERATIONAL IMPROVEMENTS TO THE ZORN INTERCHANGE. (2004BOPC)",RECONSTRUCTION(O),Add Lane to Full Control Facility,1,Jefferson,056-I-0071  -000,0.0,2.5,Existing,0.0,0,0.0,0.0
458,774,459,5,KIPDA ADD,IP20150447,5-65.40,WIDEN I-64 TO 6-LANES FROM 0.458 MILE EAST OF THE KY-55 INTERCHANGE TO THE KY-1790 UNDERPASS. (2006BOPC),MAJOR WIDENING(O),Add Lane to Full Control Facility,1,Shelby,106-I-0064  -000,32.3,35.9,Existing,0.0,0,0.0,0.0
442,795,443,5,Louisville-Southern Indiana (KIPDA) MPO,IP20150195,5-371.13,RECONSTRUCT KY-22 AT GOOSE CREEK ROAD. (06CCN) (2004BOPC)(14CCR)(18CCR),SAFETY(P),Improve Intersection,2,Jefferson,056-CR-1014  -000,0.0,0.16,Existing,0.0,0,0.0,0.0
331,54,332,4,Lincoln Trail ADD,IP20080736,,"CONSTRUCTION OF A CONNECTOR ROAD FROM KY 2154 VIA HENDRICKSON DRIVE TO KY 55, ALIGNING KY 2154 WITH THE LEBANON BYPASS.  ESTIMATED TOTAL LENGTH: 1.1 MILES.",Bypass,Construct Road in New Location,2,Marion,078-PF-9999  -000,0.0,0.0,Proposed,0.0,0,0.0,0.0
325,375,326,4,Lincoln Trail ADD,IP20070186,,ADDRESS SAFETY AND GEOMETRIC DEFICIENCIES ALONG US 31E FROM HODGENVILLE SQUARE TO THE NORTHERN INTERSECTION OF KY 470 AT WHITE CITY,Reconstruction,Modernize Roadway-Rural,1,Larue,062-US-0031  -000,10.093,14.78,Existing,0.0,0,0.0,0.0
246,346,247,3,Barren River ADD,IP20140045,,Improve safety and address geometric deficiencies at the intersection of KY 259 and KY 2336.,Spot Improvement,Other Improvement Types,2,Edmonson,031-KY-2336  -000,3.4219999999999997,3.522,Existing,0.088374124,247,-0.09523679822526795,-0.006862674225267956
961,932,962,12,FIVCO ADD,IP20190046,,Construct extension of KY 1185 from Boy Scout Road at Yatesville Lake to around the headwaters of the lake to KY 3215. 4.23 miles,New Route,Construct Road in New Location,2,Lawrence,064-KY-1185  -000,0.0,0.001,Existing,-0.014305051000000001,0,0.0,-0.014305051000000001
133,170,134,2,Green River ADD,IP20070127,,Address service concerns of KY 630 from KY 132 in Dixon to the Hopkins County Line,Reconstruction,Other Improvement Types,3,Webster,117-KY-0120  -000,14.765,15.097999999999999,Existing,0.35869456899999996,134,-0.385465254,-0.026770685000000016
111,313,112,2,Green River ADD,IP20060126,,Address safety concern of KY 283 and KY 1191 intersection.,Reconstruction,Improve Intersection,1,Webster,117-KY-0283  -000,2.489,2.589,Existing,-0.000939927,112,-0.0398645307592392,-0.0408044577592392
732,817,733,8,Bluegrass ADD,IP20180037,8-80008,ADD A TURNING LANE ON US 150 AT WILDERNESS TRAIL ROAD(18CCN),SAFETY(P),Improve Intersection,1,Lincoln,069-US-0150  -000,1.3,1.7,Existing,-0.057735954000000006,0,0.0,-0.057735954000000006
928,848,929,12,Kentucky River ADD,IP20110062,,Reconstruct section with sharp curve at KY 463 intersection with KY 510.,Safety-Haz-Elm,Modernize Roadway-Rural,1,Letcher,067-KY-0463  -000,0.537,0.737,Existing,-0.169105008,929,0.10278533209865257,-0.06631967590134744
479,472,480,5,Louisville-Southern Indiana (KIPDA) MPO,IP20160019,5-560,IMPROVE SAFETY AND REDUCE CONGESTION AT THE I-65/I-265 (GENE SNYDER FREEWAY) INTERCHANGE.,RECONSTRUCTION(O),Innovative Interchange,8,Jefferson,056-I -0065  -141,0.0,0.8370000000000001,Existing,-0.093532089,0,0.0,-0.093532089
215,382,216,3,Barren River ADD,IP20060183,Mar-54,RECONSTRUCT INTERSECTION OF KY 63 AND POPLAR LOG CHURCH ROAD. (16CCN),RECONSTRUCTION(O),Improve Intersection,2,Monroe,086-CR-1200  -000,4.128,4.178,Existing,-0.094300479,0,0.0,-0.094300479
247,94,248,3,Barren River ADD,IP20140046,,Improve safety and address geometric deficiencies on KY 259 from MP 8.35 to MP 8.65.,Spot Improvement,Modernize Roadway-Rural,1,Edmonson,031-KY-0259  -000,8.35,8.65,Existing,0.0,248,-0.10373735802251016,-0.10373735802251016
75,385,76,1,Pennyrile ADD,IP20160149,Jan-51,REALIGN KY 124 APPROACH TO KY 139 TO IMPROVE INTERSECTION ANGLE AND SIGHT DISTANCE. (16CCN)(18CCN),AIR QUALITY(P),Improve Intersection,1,Trigg,111-KY-0139  -000,17.8,17.95,Existing,0.456139919,76,-0.5644515965262813,-0.10831167752628129
1,34,2,1,Purchase ADD,IP20020002,,Address economic development issues for Fulton County Industrial Park and access issues for high clearance vehicles  between KY 307 and US 51 due to the low clearance railroad bridges located on KY 307 & KY 94.,New Route,Local Roadway Improvements,2,Fulton,038-CS-2094  -000,0.0,0.38,Existing,-0.115089755,0,0.0,-0.115089755
34,247,35,1,Purchase ADD,IP20080010,,Correct roadway geometrics and address congestion and safety issues at KY 1550 (Wisewell Road) and Johnny Robertson Road near Murray.,Reconstruction,Improve Intersection,1,Calloway,018-KY-1550  -000,4.5,4.6,Existing,-0.24728023300000002,35,0.11183676873942339,-0.13544346426057663
735,528,736,8,Lake Cumberland ADD,IP20180093,,Improve the existing city and county routes by widening and extending.  This improvement with improve connectivity and will relieve some congestion on US 127 during peak traffic volumes.,New Route,Construct Road in New Location,1,Russell,104-CS-2098  -000,0.0,0.45299999999999996,Existing,-0.137320078,0,0.0,-0.137320078
750,700,751,8,Lake Cumberland ADD,IP20190165,,"Improve the existing route, CS-2098 (Erik Ln), by widening and extending it to connect to KY 1381 (Voils Road).  This improvement with improve connectivity and will relieve some congestion on US 127 during peak traffic volumes.",New Route,Construct Road in New Location,1,Russell,104-CS-2098  -000,0.0,0.45299999999999996,Existing,-0.137320078,0,0.0,-0.137320078
8,316,9,1,Purchase ADD,IP20060007,,Improve geometric deficiencies and truck mobility at the intersection with KY286 in Wickliffe.,Reconstruction,Improve Intersection,1,Ballard,004-KY-0121  -000,8.262,8.369,Existing,-0.356177772,9,0.19192071962777518,-0.16425705237222482
184,21,185,2,Pennyrile ADD,IP20180059,,Upgrade the US 62 Interchange (Exit 33) on the Pennyrile Parkway near the City of Nortonville to Interstate Standards.,Reconstruction,,1,Hopkins,054-EB-9004  -000,32.65,33.05,Existing,-0.21426661800000002,185,0.03130101822196576,-0.18296559977803425
106,350,107,2,Green River ADD,IP20060096,,Address safety concerns of the intersection of KY 2181 and Ed Brown Road in Hancock County.,Safety-Haz-Elm,Improve Intersection,1,Hancock,046-KY-2181  -000,2.7239999999999998,2.824,Existing,-0.022811292,107,-0.16054918732846682,-0.18336047932846683
210,99,211,3,Barren River ADD,IP20060173,,Improve safety on KY 70 at the intersection of KY 869.,Spot Improvement,Improve Intersection,1,Metcalfe,085-KY-0070  -000,6.8,7.0,Existing,0.174376122,211,-0.38591202515116285,-0.21153590315116286
285,149,286,3,Barren River ADD,IP20190094,,Improve safety and sight distance at the intersection of KY 98 and KY 671.,Spot Improvement,Improve Intersection,2,Allen,002-KY-0671  -000,4.52,4.57,Existing,-0.17117789600000002,286,-0.07365118489228817,-0.2448290808922882
35,392,36,1,Purchase ADD,IP20080010,,Correct roadway geometrics and address congestion and safety issues at KY 1550 (Wisewell Road) and Johnny Robertson Road near Murray.,Reconstruction,Improve Intersection,2,Calloway,018-CR-1363  -000,1.4340000000000002,1.445,Existing,-0.24728023300000002,0,0.0,-0.24728023300000002
36,214,37,1,Purchase ADD,IP20080010,,Correct roadway geometrics and address congestion and safety issues at KY 1550 (Wisewell Road) and Johnny Robertson Road near Murray.,Reconstruction,Improve Intersection,3,Calloway,018-CS-1292  -000,0.0,0.012,Existing,-0.24728023300000002,0,0.0,-0.24728023300000002
835,916,836,10,Kentucky River ADD,IP20110133,,New and better access to Wendell Ford Airport,New Route,Construct Road in New Location,1,Perry,097-CR-1365  -000,0.0,1.0,Existing,-0.24911685100000003,0,0.0,-0.24911685100000003
158,345,159,2,Green River ADD,IP20140039,,"Address safety concerns of narrow bridges, box culverts and lack of shoulders on KY 492 from US 60 to KY 109.",Safety-Haz-Elm,Other Improvement Types,1,Union,113-KY-0492  -000,2.4819999999999998,5.154,Existing,0.140515105,159,-0.392954119,-0.252439014
789,520,790,9,Bluegrass ADD,IP20150147,9-205,IMPROVE THE KY-36/KY-32 INTERSECTION NEAR THE NICHOLAS COUNTY SCHOOL PROPERTY. (12CCR)(16CCR),SAFETY(P),Modernize Roadway-Rural,1,Nicholas,091-KY-0036  -000,3.1,3.283,Existing,-3.730513072,790,3.475225335744974,-0.2552877362550259
216,300,217,3,Barren River ADD,IP20060184,,Improve safety of the KY-63 - KY-870 intersection.,Spot Improvement,Improve Intersection,1,Monroe,086-KY-0063  -000,16.058,16.258,Existing,0.123927014,217,-0.415667717215284,-0.291740703215284
370,232,371,4,Lincoln Trail ADD,IP20160070,17-Apr,HEARTLAND PARKWAY: MARION/TAYLOR LINE TO LEBANON BYPASS.(16CCN)(18CCN),MAJOR WIDENING(O),Modernize & Widen Roadway-Rural,1,Marion,078-US-0068  -000,0.0,9.363999999999999,Existing,-16.59792311,371,16.296764391000004,-0.30115871899999647
214,400,215,3,Barren River ADD,IP20060183,Mar-54,RECONSTRUCT INTERSECTION OF KY 63 AND POPLAR LOG CHURCH ROAD. (16CCN),RECONSTRUCTION(O),Improve Intersection,1,Monroe,086-KY-0063  -000,10.5,10.6,Existing,-0.094300479,215,-0.21451639607714149,-0.3088168750771415
207,351,208,3,Barren River ADD,IP20060166,8-Mar,IMPROVE SAFETY BY IMPROVING SIGHT LINES CROSSING RAILROAD BETWEEN STOCKYARDS AND INDUSTRIAL PARK. (16CCN)(18CCN),SAFETY(P),Modernize Roadway-Rural,1,Logan,071-KY-2349  -000,0.0,0.643,Existing,0.6283399789999999,208,-0.9416906460000001,-0.31335066700000014
790,706,791,9,Bluegrass ADD,IP20150176,11-Sep,RECONSTRUCT KY 36/KY 928 INTERSECTION. (14CCN)(16CCR)(18CCN),RECONSTRUCTION(O),Improve Intersection,1,Nicholas,091-KY-0036  -000,8.0,8.23,Existing,-0.26287283300000003,791,-0.11035280462901371,-0.37322563762901373
289,33,290,3,Barren River ADD,IP20190100,,Improve safety and mobility on KY 100 at the narrow bridge over Spring Creek.,Bridge Replacement,Other Improvement Types,1,Monroe,086-KY-0100  -000,1.72,1.77,Existing,0.0,290,-0.39968970712179286,-0.39968970712179286
179,122,180,2,Pennyrile ADD,IP20160214,2-898,RECONSTRUCT THE BREATHITT PARKWAY INTERCHANGE AT KY 1682 NORTH OF HOPKINSVILLE. (BREATHITT PARKWAY/FUTURE INTERSTATE SPUR PROJECT) (16CCR)(18CCN),RECONSTRUCTION(O),Innovative Interchange,1,Christian,024-EB-9004  -000,11.39,11.99,Existing,-1.848221755,180,1.429080869556257,-0.41914088544374306
869,941,870,11,Kentucky River ADD,IP20110205,,Reconstruct US 421 from the Leslie/Harlan County Line to MP 2.00.,Reconstruction,Modernize Roadway-Rural,1,Leslie,066-US-0421  -000,0.0,2.0,Existing,0.9012730309999999,870,-1.3349031969999996,-0.4336301659999997
284,13,285,3,Barren River ADD,IP20190094,,Improve safety and sight distance at the intersection of KY 98 and KY 671.,Spot Improvement,Improve Intersection,1,Allen,002-KY-0098  -000,8.85,8.95,Existing,-0.17117789600000002,285,-0.27979543534775864,-0.45097333134775863
382,275,383,4,Lincoln Trail ADD,IP20180030,4-80050,CONSTRUCT A ROUNDABOUT AT THE INTERSECTION OF US-31E AND US-62. (NELSON COUNTY FISCAL COURT WILL DO DESIGN AND BUILD ROUNDABOUT)(18CCN),CONGESTION MITIGTN(O),Improve Intersection,2,Nelson,090-US-0062  -000,14.2,14.274000000000001,Existing,-1.122371091,383,0.6655636261958484,-0.4568074648041516
368,121,369,4,Lake Cumberland ADD,IP20160012,12-Apr,SCOPING STUDY TO IMPROVE KY 210 FROM CAMPBELLSVILLE TO HODGENVILLE. ADD PASSING LANES AND ADDRESS GEOMETRIC DEFICIENCIES(SAME AS 4-8951.00) (16CCN),MINOR WIDENING(O),Modernize & Widen Roadway-Rural,3,Green,044-KY-0210  -000,0.0,0.75,Existing,0.5547597160000001,369,-1.0126309599999999,-0.4578712439999998
233,340,234,3,Barren River ADD,IP20110032,,Improve safety and address horizontal geometric deficiencies at the narrow bridge on KY 187.,Reconstruction,Other Improvement Types,1,Edmonson,031-KY-0187  -000,2.15,2.25,Existing,0.0,234,-0.472054651615307,-0.472054651615307
243,239,244,3,Pennyrile ADD,IP20120050,,Reduce congestion and improve safety and mobility on US-68X from MP 2.192 to 2.402 in Elkton.,Spot Improvement,Improve Intersection,1,Todd,110-US-0068  -000,2.1919999999999997,2.4019999999999997,Existing,-0.47331930899999997,0,0.0,-0.47331930899999997
102,249,103,2,Green River ADD,IP20060091,,Address safety concerns of the KY-69 and B. Rice Road intersection to provide for better sight distance.,Safety-Haz-Elm,Improve Intersection,1,Hancock,046-KY-0069  -000,8.902999999999999,9.193,Existing,-0.105249865,103,-0.3993317360684643,-0.5045816010684643
264,322,265,3,Barren River ADD,IP20170040,,Improve safety at the intersection of KY 79 and KY 103.,Spot Improvement,Improve Intersection,2,Logan,071-KY-0103  -000,10.195,10.27,Existing,-0.409164807,265,-0.11186784761066264,-0.5210326546106626
838,889,839,10,Bluegrass ADD,IP20120046,,Correct flooding issues on KY 613 at Bowen from KY 11 to Bridge over Red River in Powell County.,Spot Improvement,Other Improvement Types,1,Powell,099-KY-0613  -000,0.0,0.363,Existing,-0.27519539,839,-0.24894884812525855,-0.5241442381252586
290,218,291,3,Barren River ADD,IP20190102,,Improve safety and mobility on KY 100 at the narrow bridge over Indian Creek.,Bridge Replacement,Other Improvement Types,1,Monroe,086-KY-0100  -000,4.0,4.1,Existing,0.0,291,-0.5412766133476145,-0.5412766133476145
130,37,131,2,Green River ADD,IP20070123,,Address service and safety concern of the intersection of KY 132 and KY 270. This is a break out of project 02 117 D0132 88.10,Safety-Haz-Elm,Improve Intersection,1,Webster,117-KY-0132  -000,8.777999999999999,8.878,Existing,-0.189176062,131,-0.42047743640434454,-0.6096534984043446
288,62,289,3,Barren River ADD,IP20190099,,Improve safety and sight distance at the intersection of US 68 and KY 2399.,Spot Improvement,Improve Intersection,1,Metcalfe,085-US-0068  -000,11.45,11.55,Existing,-0.5962185520000001,289,-0.03180820803708312,-0.6280267600370832
861,959,862,11,Cumberland Valley ADD,IP20080605,,Address substandard horizontal and vertical alignment of US 421 in the Clover Bottom Area near the stone quarry.,Reconstruction,Modernize Roadway-Rural,1,Jackson,055-US-0421  -000,26.5,27.0,Existing,-0.247999795,862,-0.41230894216446723,-0.6603087371644673
930,841,931,12,Kentucky River ADD,IP20110151,,Eliminate rockfall hazards from kY 2029 to Rock Fork Road.,Safety-Haz-Elm,Maintenance Improvement,1,Knott,060-KY-0080  -000,14.69,16.0,Existing,-0.6788561890000001,0,0.0,-0.6788561890000001
161,271,162,2,Green River ADD,IP20150141,Feb-52,CORRECT LINE OF SIGHT WITH INTERSECTION OF KY 56 & KY 1233. (14CCN)(18CCN),RECONSTRUCTION(O),Improve Intersection,1,McLean,075-KY-0056  -000,6.0,6.33,Existing,0.155480406,162,-0.8921473569773175,-0.7366669509773175
26,58,27,1,Purchase ADD,IP20060065,,Correct geometric alignment deficiencies and address access and traffic flow issues at US 62 / US 641 / KY 282 interchange.,Reconstruction,Innovative Interchange,4,Marshall,079-US-0641  -000,19.132,19.25,Existing,0.0,27,-0.7380327150354676,-0.7380327150354676
868,837,869,11,Cumberland Valley ADD,IP20110173,,Address congestion/capacity issues on US-119 near Clear Glass Road and Conley Loop.,Minor Widening,Modernize Roadway-Rural,1,Harlan,048-US-0119  -000,10.66,10.79,Existing,0.0,869,-0.7396673241972019,-0.7396673241972019
149,72,150,2,Green River ADD,IP20080120,,Address safety and service concerns of the KY 120 and KY 630 intersection. This is a breakout of Project 02 117 D0120 3.00,Reconstruction,Improve Intersection,1,Webster,117-KY-0120  -000,14.765,14.865,Existing,-0.644620216,150,-0.1058703186693849,-0.7504905346693849
793,444,794,9,Gateway ADD,IP20150223,4-Sep,RECONSTRUCT CURVE AT .8 MILE SOUTH OF KY-36.  (08CCN)(12CCR),RECONSTRUCTION(O),Modernize Roadway-Rural,1,Bath,006-KY-0965  -000,7.147,7.247000000000001,Existing,0.0,794,-0.7749484559170821,-0.7749484559170821
822,541,823,10,Gateway ADD,IP20000075,,Complete spot improvement to modernize the roadway on KY 713 in the Fagan area from approximately Milepoint 6.6 to approximately Milepoint 7.25.,Spot Improvement,Modernize Roadway-Rural,1,Menifee,083-KY-0713  -000,6.6,7.25,Existing,-0.01307529,823,-0.7694374888396726,-0.7825127788396725
196,205,197,3,Barren River ADD,IP20060132,,Improve safety at the intersection of KY 98 and KY 3499 in Scottsville.,Reconstruction,Improve Intersection,2,Allen,002-KY-3499  -000,0.0,0.1,Existing,-0.236708323,197,-0.5827927692123573,-0.8195010922123573
434,649,435,5,KIPDA ADD,IP20150052,,Address safety and geometric issues on KY 44 at Junction KY 1251 to curve after Hunter's Trace Road.,Spot Improvement,Modernize Roadway-Rural,1,Spencer,108-KY-0044  -000,5.6,6.2,Existing,0.735336495,435,-1.6064366572695485,-0.8711001622695486
17,348,18,1,Purchase ADD,IP20060016,,Improve roadway geometrics at Y-intersection of US 62 & KY 307 to provide adequate sight distance and address safety concerns.,Reconstruction,Improve Intersection,3,Carlisle,020-KY-0307  -024,0.0,0.047,Existing,-0.886929207,0,0.0,-0.886929207
344,236,345,4,Lincoln Trail ADD,IP20110149,,"ADDRESS SAFETY, GEOMETRIC DEFICIENCIES AND MAINTENANCE ISSUES ALONG KY 259 FROM BEAR CREEK ROAD (MP 9.217) TO NORTHERN INTERSECTION OF BLOOMINGTON ROAD (MP 11.761) SOUTH OF LEITCHFIELD",Reconstruction,Modernize Roadway-Rural,1,Grayson,043-KY-0259  -000,9.217,11.761,Existing,2.02854423,345,-2.915592579000001,-0.887048349000001
378,35,379,4,Elizabethtown-Radcliff MPO,IP20170082,,RECONSTRUCT INTERSECTION OF US 31W AT PEAR ORCHARD ROAD NW AND VETERANS WAY,Reconstruction,Improve Intersection,1,Hardin,047-CS-1297  -000,0.932,1.032,Existing,-0.8564129859999999,379,-0.047662701481072996,-0.9040756874810729
527,812,528,5,Louisville-Southern Indiana (KIPDA) MPO,IP20160276,5-367.20,EXTENSION OF OLD HENRY ROAD EAST TO ASH AVENUE (KY362). (12CCR)(18CCN),NEW ROUTE(O),Construct Road in New Location,4,Oldham,093-KY-0146  -000,0.0,0.63,Impacted,-0.732469975,528,-0.19235090999999915,-0.9248208849999991
206,217,207,3,Barren River ADD,IP20060164,,Improve safety at the KY 79 - Marshall Road intersection.,Spot Improvement,Improve Intersection,1,Logan,071-KY-0079  -000,5.4,6.0,Existing,0.473202344,207,-1.4558907072687437,-0.9826883632687438
245,9,246,3,Barren River ADD,IP20140045,,Improve safety and address geometric deficiencies at the intersection of KY 259 and KY 2336.,Spot Improvement,Other Improvement Types,1,Edmonson,031-KY-0259  -000,20.614,20.814,Existing,0.088374124,246,-1.0829589440948073,-0.9945848200948073
249,390,250,3,Barren River ADD,IP20140058,,Improve safety and address geometric deficiencies in the curve along KY 259 between Kinslow Cemetery Rd and KY 2325 (Silent Grove Church Rd),Spot Improvement,Modernize Roadway-Rural,1,Edmonson,031-KY-0259  -000,6.75,7.0,Existing,-0.042718217,250,-0.9608282803569441,-1.0035464973569441
937,895,938,12,Big Sandy ADD,IP20150005,,"Make safety spot improvements at this high crash location.  Priority 3 of 8 of recommended spot improvement in referenced study.  Spot 10, Section 5.",Spot Improvement,Other Improvement Types,1,Pike,098-KY-0632  -000,11.5,12.0,Existing,-0.0056769690000000005,938,-1.0073409483529452,-1.0130179173529452
826,723,827,10,Gateway ADD,IP20060263,,"Improve safety, correct geometrics, and enhance regional connectivity on US 460 from the intersection of KY 713 to Rothwell (MP 4.8).",Reconstruction,Modernize Roadway-Rural,1,Menifee,083-US-0460  -000,0.10099999999999999,4.8,Existing,-3.0904779889999996,827,2.06439873211383,-1.0260792568861694
811,658,812,9,FIVCO ADD,IP20160293,,"KY 3297 carries approximately 3,080 vpd near East Carter Middle School. According to school officials and other stakeholders, KY 3297 becomes congested when long queues form as motorists wait to turn into the East Carter Middle School parking lot. These",,Improve Intersection,1,Carter,022-KY-3297  -000,0.325,0.45,Existing,-0.43981920399999996,812,-0.5941908321929998,-1.0340100361929998
837,952,838,10,Kentucky River ADD,IP20120019,10-366,RECONSTRUCTION OF KY 11 IN OWSLEY COUNTY BEGINNING AT THE CLAY COUNTY LINE AND EXTENDING 1 MILE NORTH ALONG KY 11 (MP 0 TO MP 1.0). (2014BOP),RECONSTRUCTION(O),Construct Road in New Location,1,Owsley,095-KY-0011  -000,0.0,1.0,Existing,-0.005796007,838,-1.0894244427571427,-1.0952204497571427
931,853,932,12,Kentucky River ADD,IP20110152,,Curve revision 3.654 miles east of intersection of KY 3209 & KY 1087.,Safety-Haz-Elm,Modernize Roadway-Rural,1,Knott,060-KY-1087  -000,5.05,5.25,Existing,0.0,932,-1.1134917957272727,-1.1134917957272727
761,536,762,9,Buffalo Trace ADD,IP20080547,8-Sep,RECONSTRUCT INTERSECTION AT KY-9 AND KY-2523.  (14CCN),RECONSTRUCTION(O),Improve Intersection,1,Lewis,068-KY-0009  -000,12.709000000000001,12.789000000000001,Existing,-0.827793558,762,-0.29938559747724947,-1.1271791554772495
919,869,920,12,Big Sandy ADD,IP20080686,,CURVE REVISION NEAR WARFIELD,Reconstruction,Other Improvement Types,1,Martin,080-KY-0040  -000,18.8,19.0,Existing,-1.015951302,920,-0.1127151492212144,-1.1286664512212143
954,851,955,12,Big Sandy ADD,IP20180040,12-80000,CONSTRUCT NEW INTERSECTION ON  US-23 AT THE ENTRANCE TO BETSY LANE HIGH SCHOOL(18CCN),SAFETY(P),Improve Intersection,1,Floyd,036-US-0023  -000,3.1,3.2,Existing,-1.260210207,955,0.13084233258132746,-1.1293678744186726
