,FID_1,ProjectNo,Dist,AddMPOName,IDENTIFIER,IDENTIFI_1,DESC_,PROJTYPE,ESTIMPRVAS,ROUTEORDER,TYCOUNTYDI,Routeuniqu,BEGINNINGM,ENDINGMILE,TYROUTENAM,EEC_Intersection,ProjectN_1,Roadway_EEC,Final_EEC
367,46,368,4,Lake Cumberland ADD,IP20160012,12-Apr,SCOPING STUDY TO IMPROVE KY 210 FROM CAMPBELLSVILLE TO HODGENVILLE. ADD PASSING LANES AND ADDRESS GEOMETRIC DEFICIENCIES(SAME AS 4-8951.00) (16CCN),MINOR WIDENING(O),Modernize & Widen Roadway-Rural,2,Larue,062-KY-0210  -000,6.994,16.613,Existing,7.227881837000001,368,-10.712204838999998,-3.4843230019999973
700,661,701,8,Lake Cumberland ADD,IP20110193,,Improve safety and mobility along KY 39 between Oak Leaf lane and the Northern Bypass.,Reconstruction,Modernize Roadway-Rural,1,Pulaski,100-KY-0039  -000,1.13,4.5,Existing,-10.9991184,701,7.4803418100000005,-3.51877659
359,418,360,4,Elizabethtown-Radcliff MPO,IP20150360,5-Apr,RECONSTRUCT KY 79 FROM KY 144 TO KY 1051. (12CCN)(14CCR)(18CCN),RECONSTRUCTION(O),Modernize Roadway-Rural,1,Meade,082-KY-0079  -000,4.4110000000000005,8.237,Existing,10.757926300000001,360,-14.339231091999999,-3.5813047919999974
520,694,521,5,Louisville-Southern Indiana (KIPDA) MPO,IP20160227,5-234,KY-393 RECONSTRUCT FROM 140FEET SOUTH OF RAILROAD CROSSING (CSX) EXTENDING NORTHWEST TOWARDS KY 146 ENDING AT STATION 12+00 (DESIGN UNDER 5-230.00). (CONSTRUCTION SEQ.#2),MAJOR WIDENING(O),Grade Seperation of Highway/Railroad Crossing,3,Oldham,093-KY-0146  -000,7.419,7.64,Existing,-6.816055355,521,3.1409149289999996,-3.675140426
725,756,726,8,Bluegrass ADD,IP20150463,8-80002,US 127 NEW TURNING LANE AT KY 1194(18CCN),NEW INTERCHANGE(O),Improve Intersection,1,Lincoln,069-US-0127  -000,6.8,7.1,Existing,-2.141251885,726,-1.6309272497205236,-3.7721791347205236
447,717,448,5,Bluegrass ADD,IP20150283,5-97.50,"WIDEN US 60 FROM JUST EAST OF THE EXISTING BRIDGE OVER SOUTH BENSON CREEK (B97) TO JUST WEST OF VICKY WAY, WEST OF FRANKFORT, KY.(04CCN)(10CCR)",MAJOR WIDENING(O),2 Lane to 4 Lane Divided - Rural,1,Franklin,037-US-0060  -000,2.78,3.9130000000000003,Existing,-3.431520711,448,-0.36212073180952437,-3.7936414428095246
486,777,487,5,Louisville-Southern Indiana (KIPDA) MPO,IP20160046,5-804,"RECONSTRUCT/WIDEN I-264 (WATTERSON EXPRESSWAY) FROM WESTPORT ROAD (KY-1447) TO I-71, INCLUDING THE US-42 INTERCHANGE AS A SPUI.(PROJECT INCLUDES 5-594) (12CCR)(14CCR)",RECONSTRUCTION(O),Innovative Interchange,4,Jefferson,056-I -0264  -852,0.0,0.161,Impacted,-3.793901201,0,0.0,-3.793901201
92,81,93,1,Purchase ADD,IP20190057,,Correct roadway geometrics and address congestion and safety issues at KY 94 and KY 1660 (Johnny Robertson Road) near Murray.,Spot Improvement,,1,Calloway,018-KY-0094  -000,7.598,7.797999999999999,Existing,-2.9010595319999997,93,-0.9202179656017151,-3.8212774976017148
187,319,188,2,Pennyrile ADD,IP20180062,,Upgrade US 68 Interchange (Exit 9) on the Pennyrile Parkway to Interstate Standards,Reconstruction,,1,Christian,024-EB-9004  -000,9.147,9.547,Existing,-3.0865536010000003,188,-0.7436666523677175,-3.8302202533677177
336,36,337,4,Elizabethtown-Radcliff MPO,IP20090009,,"ADDRESS SAFETY, GEOMETRIC DEFICIENCIES AND MAINTENANCE ISSUES ALONG US 62 EAST OF ELIZABETHTOWN FROM UPPER COLESBURG ROAD TO STOVALL ROAD.",Reconstruction,Modernize Roadway-Rural,1,Hardin,047-US-0062  -000,23.351,25.499000000000002,Existing,0.063401119,337,-4.039931086000001,-3.976529967000001
94,174,95,1,Purchase ADD,IP20190057,,Correct roadway geometrics and address congestion and safety issues at KY 94 and KY 1660 (Johnny Robertson Road) near Murray.,Spot Improvement,,999,Calloway,018-KY-1660  -000,0.0,0.1,Approach,-2.9010595319999997,95,-1.221968627046677,-4.123028159046677
828,688,829,10,Bluegrass ADD,IP20080566,10-205,"IMPROVE LEVEL OF SERVICE, SAFETY, AND CONNECTIVITY ON KY-82 FROM KY-89 IN ESTILL CO. TO NEW CONSTRUCTION LOCATED NORTH OF HUDSON MILL ROAD IN ESTILL COUNTY.",RECONSTRUCTION(O),Modernize Roadway-Rural,1,Estill,033-KY-0082  -000,0.0,4.1,Existing,-8.932860085,829,4.802037965986914,-4.130822119013086
487,667,488,5,Louisville-Southern Indiana (KIPDA) MPO,IP20160046,5-804,"RECONSTRUCT/WIDEN I-264 (WATTERSON EXPRESSWAY) FROM WESTPORT ROAD (KY-1447) TO I-71, INCLUDING THE US-42 INTERCHANGE AS A SPUI.(PROJECT INCLUDES 5-594) (12CCR)(14CCR)",RECONSTRUCTION(O),Innovative Interchange,5,Jefferson,056-I -0264  -853,0.0,0.013000000000000001,Impacted,-4.1536742769999995,0,0.0,-4.1536742769999995
488,698,489,5,Louisville-Southern Indiana (KIPDA) MPO,IP20160046,5-804,"RECONSTRUCT/WIDEN I-264 (WATTERSON EXPRESSWAY) FROM WESTPORT ROAD (KY-1447) TO I-71, INCLUDING THE US-42 INTERCHANGE AS A SPUI.(PROJECT INCLUDES 5-594) (12CCR)(14CCR)",RECONSTRUCTION(O),Innovative Interchange,6,Jefferson,056-I -0264  -862,0.0,0.031,Impacted,-4.1536742769999995,0,0.0,-4.1536742769999995
489,445,490,5,Louisville-Southern Indiana (KIPDA) MPO,IP20160046,5-804,"RECONSTRUCT/WIDEN I-264 (WATTERSON EXPRESSWAY) FROM WESTPORT ROAD (KY-1447) TO I-71, INCLUDING THE US-42 INTERCHANGE AS A SPUI.(PROJECT INCLUDES 5-594) (12CCR)(14CCR)",RECONSTRUCTION(O),Innovative Interchange,7,Jefferson,056-I -0264  -861,0.0,0.022000000000000002,Impacted,-4.1536742769999995,0,0.0,-4.1536742769999995
77,371,78,1,Purchase ADD,IP20170075,,"Address condition, access and future congestion issues from approx 1 mile north of Wickliffe to Ohio River Bridge.(Section L - 1993 Scoping Study)",Relocation,2 Lane to 4 Lane Divided - Rural,1,Ballard,004-US-0051  -000,4.644,7.327000000000001,Existing,-0.553095978,78,-3.6282743285186987,-4.181370306518699
757,677,758,9,FIVCO ADD,IP20080519,,Improve US 60 geometry beginning at the termini of new construction at Olive Hill (MP 12.4) (Item No. 9-159.00) extending 1.1 miles to the I-64 Exit 161 to improve systems connectivity and increase operational efficiency of the route.,Reconstruction,Modernize Roadway-Rural,1,Carter,022-US-0060  -000,12.1,13.3,Existing,-2.561757291,758,-1.8208116457216281,-4.382568936721628
913,854,914,12,FIVCO ADD,IP20080671,,Reconstruct the access into this area along existing KY 707 in order to upgrade this road facility to current standards.  KY707 MP 8.16 to 9.69 from KY 1937 to US 23 at Buchanan.,Major Widening,Modernize Roadway-Rural,1,Lawrence,064-KY-0707  -000,8.16,9.69,Existing,-0.03255428,914,-4.3502245785807965,-4.382778858580797
924,880,925,12,Big Sandy ADD,IP20080708,,"Improve commuter safety on this portion of roadway over Hardy Mountain, from Blackberry Creek to Turkeytoe Branch.",Reconstruction,Other Improvement Types,1,Pike,098-KY-0319  -000,0.35,2.35,Existing,-0.607693646,925,-3.788194141185792,-4.395887787185792
710,655,711,8,Lake Cumberland ADD,IP20150083,,Improve safety and mobility of KY 738 between US 127 and US 127X.,Safety-Haz-Elm,Modernize Roadway-Rural,1,Clinton,027-KY-0738  -000,5.519,6.706,Existing,-4.2065231039999995,711,-0.1956324900000006,-4.402155594
914,906,915,12,FIVCO ADD,IP20080672,,To upgrade the access to the marina from KY 3 in order to better accommodate recreational traffic using the road.  KY 1185 MP 0.00 to 2.232 at Yatesville Lake,Major Widening,Modernize Roadway-Rural,1,Lawrence,064-KY-1185  -000,0.0,2.2319999999999998,Existing,-1.139694037,915,-3.2813003729999997,-4.42099441
43,258,44,1,Purchase ADD,IP20080032,,"Correct geometric deficiencies, and improve safety, access and regional connectivity from Bayou De Chein Bridge to Martin Road.",Reconstruction,Modernize Roadway-Rural,1,Hickman,053-US-0051  -000,4.508,6.65,Existing,0.342758667,44,-4.775768576,-4.433009909
380,354,381,4,Lincoln Trail ADD,IP20180024,,"Address safety, congestion, and mobility at the eastern intersection of US 68 and KY 2154 and along US 68 and KY 2154.  improve the intersection of US 68/KY 2154 and along US 68 from entrance to TG Kentucky to the previous widening and along KY 2154/Corp",Minor Widening,Install Two-way Left Turn Lane,2,Marion,078-KY-2154  -000,0.004,0.6,Existing,-11.33892984,381,6.86618458423818,-4.47274525576182
696,579,697,8,Cumberland Valley ADD,IP20080501,,Reconstruct KY-1326 from KY-461 intersection to Quarry Street (CS-1075) in Mt. Vernon.,Major Widening,Modernize Roadway-Rural,1,Rockcastle,102-KY-1326  -000,4.178999999999999,4.996,Existing,-6.058060706,697,1.5639960019999992,-4.494064704000001
898,923,899,11,Cumberland Valley ADD,IP20180075,,"Construct a new route to address access issue on KY 72 from Alva/Black Star near Harlan/Bell County line to Liggett, which is west of the city of Harlan",New Route,Construct Road in New Location,3,Harlan,048-KY-2005  -000,0.0,5.1,Existing,-0.29714361899999997,899,-4.2352359989999995,-4.532379617999999
791,630,792,9,Gateway ADD,IP20150203,9-193,"RECONSTRUCT KY-111 IN THE VICINITY OF THE ""S-CURVE"" EAST OF OWINGSVILLE.(14CCR)",RECONSTRUCTION(O),Modernize Roadway-Rural,1,Bath,006-KY-0111  -000,1.0,1.5,Existing,0.0,792,-4.546595785182795,-4.546595785182795
867,931,868,11,Cumberland Valley ADD,IP20080623,,Address safety and surface condition issues on KY 727 (West 5th Street) from Poplar Street to West 4th Street in Corbin.,Reconstruction,Modernize Roadway-Rural,1,Whitley,118-KY-0727  -000,3.7,4.48,Existing,-4.4841514380000005,868,-0.18469646614998708,-4.668847904149987
73,31,74,1,Purchase ADD,IP20160023,Jan-52,IMPROVE N 16TH STREET FROM KY 1327 (5 POINTS) TO KY 121. (16CCN),SAFETY(P),Modernize Roadway-Rural,999,Calloway,018-KY-1327  -000,1.4780000000000002,1.5,Approach,-5.571712073,74,0.888771367,-4.682940705999999
72,168,73,1,Purchase ADD,IP20160023,Jan-52,IMPROVE N 16TH STREET FROM KY 1327 (5 POINTS) TO KY 121. (16CCN),SAFETY(P),Modernize Roadway-Rural,999,Calloway,018-KY-0774  -000,0.451,0.483,Approach,-5.571712073,73,0.887559942,-4.684152130999999
674,715,675,8,Lake Cumberland ADD,IP20040024,,Improve safety and reduce congestion along KY 3491 between KY 80 and Russell Creek Bridge.,Minor Widening,Modernize Roadway-Rural,1,Adair,001-KY-3491  -000,0.0,1.286,Existing,-2.329577272,675,-2.575736331152586,-4.905313603152585
591,583,592,6,Northern Kentucky ADD,IP20160091,6-202,RECONSTRUCT US-42 ALONG THE OHIO RIVER TO CORRECT LANDSLIDE PROBLEMS BETWEEN MARKLAND DAM AND CRAIGS CREEK.(U-04DEOB)(10CCR)(14CCR),LANDSLIDE REPAIR(P),Maintenance Improvement,1,Gallatin,039-US-0042  -000,3.325,4.636,Existing,2.186607027,592,-7.0928382756582575,-4.9062312486582575
346,289,347,4,Lincoln Trail ADD,IP20130044,,"ADDRESS SAFETY, GEOMETRIC DEFICIENCIES AND MAINTENANCE ISUES ALONG KY 54 FROM THE EASTERN INTERSECTION OF KY 631 TO KY 2193 WEST OF LEITCHFIELD.",Reconstruction,Modernize Roadway-Rural,1,Grayson,043-KY-0054  -000,11.632,14.815999999999999,Existing,0.597013746,347,-5.526041107999999,-4.929027361999999
221,124,222,3,Barren River ADD,IP20060199,,Reduce congestion and improve mobility along KY-1008 from US-31W south of Franklin to KY-100 west of Franklin.,Major Widening,Install Two-way Left Turn Lane,1,Simpson,107-KY-1008  -000,0.0,2.276,Existing,3.135771394,222,-8.122125880999999,-4.986354486999999
889,867,890,11,Cumberland Valley ADD,IP20160062,,"Enhancing Cumberland Avenue from US 25E to 18th Street with street improvements for vehicle and pedestrians, as well as storm water management to improve safety, congestion, and environmental impact.",Congestion Management,Modernize Roadway-Rural,1,Bell,007-KY-0074  -000,15.19,16.753,Existing,-32.35845078,890,27.354758125999997,-5.003692654000002
823,683,824,10,Big Sandy ADD,IP20040032,,RECONSTRUCT FROM WILL BAILEY BRANCH ROAD TO KY 1090.,Reconstruction,Modernize Roadway-Rural,1,Magoffin,077-KY-0007  -000,22.5,23.8,Existing,-3.032625883,824,-2.4650297385260873,-5.497655621526087
778,504,779,9,FIVCO ADD,IP20110212,,Reconstruct KY 2 to correct horizontal and vertical deficiencies from 0.02 mi W of Dean Loop Road (MP 3.80) to approximately 0.20 mi W of Smokey Valley Road (MP 4.90).,Reconstruction,Other Improvement Types,1,Carter,022-KY-0002  -000,3.8,4.9,Existing,-0.38147101899999997,779,-5.13405657373867,-5.51552759273867
740,640,741,8,Lake Cumberland ADD,IP20190036,,Improve safety by constructing multiple turning lanes into Community Park Road and Whitley City Elementary School.,Minor Widening,Modernize Roadway-Rural,1,McCreary,074-US-0027  -000,10.9,12.0,Existing,0.736595021,741,-6.406839655087678,-5.670244634087678
858,955,859,11,Cumberland Valley ADD,IP20080590,,"Address safety, capacity, surface condition, and access issues from KY 3560 (Fox Hollow Road) to KY-11 at Treadway (Laurel Creek)",Reconstruction,Modernize Roadway-Rural,1,Clay,026-US-0421  -000,20.213,24.016,Existing,-0.632771382,859,-5.113200105999991,-5.7459714879999915
693,821,694,8,Bluegrass ADD,IP20080493,,Continue ongoing improvements to US 27 Corridor from Somerset to Lexington. Improve Level of Service and safety on US 27 from KY 328 to KY 501 in Lincoln County.,Major Widening,Modernize Roadway-Rural,1,Lincoln,069-US-0027  -000,3.127,7.22,Existing,2.830746346,694,-8.598246398000002,-5.767500052000003
633,441,634,7,Bluegrass ADD,IP20150117,,"Improve intersection at KY 34 and US 150 and address safety, congestion, and level of service from Cowan Street to US 150.",Congestion Management,Improve Intersection,1,Boyle,011-KY-0034  -000,13.19,13.629000000000001,Existing,-5.213180509,634,-0.610355801,-5.82353631
844,965,845,10,Kentucky River ADD,IP20150364,2-Oct,HILL AND CURVE CORRECTION ON KY-191 BETWEEN HAZEL GREEN AND KY-205. (02CCN)(08CCR)(10CCR),SAFETY(P),Maintenance Improvement,1,Wolfe,119-KY-0191  -000,10.255999999999998,14.298,Existing,1.463132725,845,-7.414072401,-5.950939676000001
153,136,154,2,Green River ADD,IP20100011,,Address safety concerns of KY 2181 from KY 144 to US 60 at Hawesville.,Reconstruction,Modernize Roadway-Rural,1,Hancock,046-KY-2181  -000,0.0,11.932,Existing,-4.305425032,154,-1.6575853619999938,-5.963010393999993
920,905,921,12,Big Sandy ADD,IP20080689,,"Address substandard roadway geometrics and pavement condition on this segment of KY 2032, from .5 miles past Ralph Moore Lane to 1.3 miles past Thickety Fork Road.",Minor Widening,Modernize Roadway-Rural,1,Martin,080-KY-2032  -000,1.9,3.0,Existing,0.480792265,921,-6.598353817981136,-6.117561552981136
712,543,713,8,Lake Cumberland ADD,IP20150090,Aug-52,IMPROVE KY-90 FROM NORRIS BRANCH ROAD EXTENDING WESTERLY TO PA DUERSON ROAD NEAR MARROWBONE. (14CCN)(18CCR),RECONSTRUCTION(O),Modernize Roadway-Rural,1,Cumberland,029-KY-0090  -000,5.182,10.432,Existing,-2.0778048780000002,713,-4.161885388000005,-6.2396902660000055
840,918,841,10,Kentucky River ADD,IP20150243,10-292.10 / 10-292.12,"I-75 TO MOUNTAIN PARKWAY; RECONSTRUCT KY-11 FROM KY-30 AT LEVI IN OWSLEY COUNTY TO THE LEE COUNTY LINE. (SEE 10-292.10 FOR D,R,U PHASES)(2016BOP)",RECONSTRUCTION(O),Modernize & Widen Roadway-Rural,1,Owsley,095-KY-0011  -000,14.343,17.494,Existing,0.116895505,841,-6.426667389,-6.309771884000001
805,564,806,9,FIVCO ADD,IP20160125,9-228,IMPROVE KY-7 FROM SOUTH CITY LIMITS OF SANDY HOOK TOWARD WRIGLEY. (12CCR)(16CCR)(18CCR),RECONSTRUCTION(O),Modernize Roadway-Rural,1,Elliott,032-KY-0007  -000,0.0,6.956,Existing,1.061941854,806,-7.467338938999989,-6.405397084999988
23,294,24,1,Purchase ADD,IP20060065,,Correct geometric alignment deficiencies and address access and traffic flow issues at US 62 / US 641 / KY 282 interchange.,Reconstruction,Innovative Interchange,1,Marshall,079-US-0062  -000,10.65,11.15,Existing,-2.397964425,24,-4.129348149,-6.527312574
943,929,944,12,Big Sandy ADD,IP20150429,12-198,IMPROVE KY 194 FROM US 119 RAMP NEAR SMITH FARMS BOTTOM (CR 1458) TO NEAR DESKINS BRANCH CULVERT. (18CCR),RECONSTRUCTION(O),Modernize Roadway-Rural,1,Pike,098-KY-0194  -000,17.951,21.0,Existing,0.139075898,944,-6.720977398864985,-6.581901500864985
345,67,346,4,Barren River ADD,IP20120064,,"PRELIMINARY DESIGN TO ADDRESS SAFETY, GEOMETRIC DEFICIENCIES AND MAINTENANCE ISSUES ALONG KY 88 FROM KY 728 IN CUB RUN TO LOGSDON VALLEY ROAD. DESIGN OF OVERALL CORRIDOR.",Reconstruction,Modernize Roadway-Rural,1,Hart,050-KY-0088  -000,5.122999999999999,15.225,Existing,1.40229751,346,-8.029478075999993,-6.627180565999993
536,443,537,5,Louisville-Southern Indiana (KIPDA) MPO,IP20190047,5-483.30,CONSTRUCT NEW I-71 INTERCHANGE BETWEEN KY-393 AND KY-53 TO RELIEVE CONGESTION IN LAGRANGE.,NEW INTERCHANGE(O),Grade Separated to Interchange,6,Oldham,093-CS-1194  -000,0.7929999999999999,1.581,Impacted,0.0,537,-6.633511845671688,-6.633511845671688
365,374,366,4,Lincoln Trail ADD,IP20150473,4-Apr,MINOR WIDENING OF KY 992 BETWEEN ROCK QUARRY AND US 60. (16CCN) (18CCN),MINOR WIDENING(O),Modernize Roadway-Rural,1,Breckinridge,014-KY-0992  -000,11.5,13.822000000000001,Existing,-3.722623998,366,-2.916636051875649,-6.639260049875649
441,634,442,5,Louisville-Southern Indiana (KIPDA) MPO,IP20150195,5-371.13,RECONSTRUCT KY-22 AT GOOSE CREEK ROAD. (06CCN) (2004BOPC)(14CCR)(18CCR),SAFETY(P),Improve Intersection,1,Jefferson,056-KY-0022  -000,2.537,2.937,Existing,-12.60773252,442,5.802182258827617,-6.8055502611723835
457,676,458,5,KIPDA ADD,IP20150426,5-8300.10,MAJOR RECONSTRUCTION OF KY-146 BETWEEN NEW CASTLE AT US-421 AND PENDLETON AT KY-153. SEGMENT 2:LOST CREEK (1/2 MILE EAST OF SAFETY KLEEN ENTRANCE) TO MAIN STREET (US 421/KY 55). MILE POINT 6.8 TO MILE POINT 9.8.(12CCN)(14CCR),RECONSTRUCTION(O),Modernize Roadway-Rural,1,Henry,052-KY-0146  -000,6.8,9.8,Existing,0.248600515,458,-7.102836220720547,-6.854235705720547
808,531,809,9,Buffalo Trace ADD,IP20160181,3-Sep,SAFETY IMPROVEMENTS AND PAVEMENT REHAB EAST OF FLEMINGSBURG BYPASS TO KY 156. (16CCN),SAFETY(P),Modernize Roadway-Rural,3,Fleming,035-KY-0011  -000,10.43,11.453,Existing,4.092222783,809,-10.971120653999998,-6.878897870999998
446,785,447,5,KIPDA ADD,IP20150281,13-May,CONSTRUCT A THIRD LANE ON US-60 FROM THE MASONIC HOME TO ROCKET LANE. (12CCN)(14CCR),RECONSTRUCTION(O),Install Two-way Left Turn Lane,1,Shelby,106-US-0060  -000,11.5,12.878,Existing,-23.76677875,447,16.773412458999996,-6.9933662910000045
959,908,960,12,FIVCO ADD,IP20190045,,"New Route KY 645 from existing US 23, KY 645 at Ulysses to the Industrial Park Road east of Grayson using KY 201 and KY 1. 33 miles",New Route,Construct Road in New Location,3,Lawrence,064-KY-0645  -000,0.0,5.205,Existing,-2.1533675480000003,960,-4.915321694,-7.0686892420000005
617,740,618,7,Bluegrass ADD,IP20080412,,Reduce congestion and reduce crashes on KY 34 (Lexington Road) from Main St. to KY 2324 in Danville,Minor Widening,Modernize Roadway-Rural,1,Boyle,011-KY-0034  -000,13.629000000000001,13.890999999999998,Existing,-13.12727419,618,5.9752066820000005,-7.152067507999999
240,358,241,3,Bowling Green MPO,IP20110202,18-Mar,THREE SPRINGS ROAD EXTENSION FROM FLEALAND TO THE NATCHER PARKWAY INCLUDING BRIDGE OVER PARKWAY. (14CCN)(18CCN),MINOR WIDENING(O),Modernize Roadway-Rural,1,Warren,114-KY-0884  -000,7.3020000000000005,8.622,Existing,5.422613698999999,241,-12.613490614250011,-7.190876915250012
692,811,693,8,Bluegrass ADD,IP20080492,,Continue ongoing improvements to US 27 corridor from Somerset to Lexington.  Improve Level of Service and safety on US 27 from KY 70 at Eubank in Pulaski to KY 328 in Lincoln County.,Major Widening,Modernize Roadway-Rural,1,Lincoln,069-US-0027  -000,0.0,3.127,Existing,-2.329896667,693,-4.9862085669999985,-7.316105233999998
902,832,903,12,Big Sandy ADD,IP20080637,,Improve site distance/lane width/shoulder width issues.  Improve entrances onto roadway.,Reconstruction,Modernize Roadway-Rural,1,Floyd,036-KY-1427  -000,4.58,9.082,Existing,-8.273890077,903,0.8896359339999904,-7.38425414300001
767,781,768,9,Buffalo Trace ADD,IP20110044,,Reconstruct KY 32    Correct width and alignment deficiencies on KY32 beginning (MP 7.3) near the Elizaville City Limits and ending at (MP 9.935)west of the FC High School.    3 Bridges located in this section of KY 32    Construct this section similar t,Reconstruction,Other Improvement Types,1,Fleming,035-KY-0032  -000,7.3,9.935,Existing,-1.039849245,768,-6.356746293925916,-7.396595538925916
19,411,20,1,Purchase ADD,IP20060030,,"Address geometric alignment issues, access issues and future capacity issues at the US 45 / KY 307 intersection in Fulton.",Reconstruction,Improve Intersection,1,Fulton,038-US-0045  -000,1.696,1.868,Existing,-4.861276516,20,-2.5358077493916746,-7.397084265391674
282,112,283,3,Barren River ADD,IP20190040,,Improve safety on US 231 at the Exit 22 interchange with I 65.,Spot Improvement,Interchange Safety Improvements,2,Warren,114-I -0065  -000,22.33,22.43,Impacted,-5.391470697999999,283,-2.1876645385168043,-7.579135236516803
742,590,743,8,Lake Cumberland ADD,IP20190146,,Improve safety and mobility along KY 55 by relocating KY 55 near KY 704 and relocating to KY 55 bypass.,Relocation,Construct Road in New Location,1,Adair,001-KY-0055  -000,9.1,10.1,Existing,-1.621066391,743,-5.993352096263662,-7.614418487263662
829,898,830,10,Bluegrass ADD,IP20080572,10-206,IMPROVE SAFETY ON KY-2459 (CARHARTT AVE.) FROM  KY-89 TO THE RAILROAD BRIDGE.(18CCR),SPOT IMPROVEMENTS(O),Modernize Roadway-Rural,1,Estill,033-KY-2459  -000,0.0,0.373,Existing,-6.29275602,830,-1.610262848,-7.903018868
689,730,690,8,Lake Cumberland ADD,IP20070240,,Improve safety and mobility along KY 1275 between KY 1765 and KY 90 near Touristville.,Reconstruction,Modernize Roadway-Rural,1,Wayne,116-KY-1275  -000,10.634,14.366,Existing,-2.797262295,690,-5.113330348000001,-7.910592643000001
532,704,533,5,Louisville-Southern Indiana (KIPDA) MPO,IP20190047,5-483.30,CONSTRUCT NEW I-71 INTERCHANGE BETWEEN KY-393 AND KY-53 TO RELIEVE CONGESTION IN LAGRANGE.,NEW INTERCHANGE(O),Grade Separated to Interchange,2,Oldham,093-I -0071  -000,20.0,21.0,Existing,0.0,533,-8.13558610852404,-8.13558610852404
702,674,703,8,Bluegrass ADD,IP20120054,,Improve safety on KY 1194 just east of Frog Branch Road to just east of Hanging Fork Creek in Lincoln County.,Reconstruction,Modernize Roadway-Rural,1,Lincoln,069-KY-1194  -000,1.5,4.1,Existing,-0.055817273,703,-8.135908707508928,-8.191725980508929
758,487,759,9,FIVCO ADD,IP20080534,,"Geometric improvements on KY 1025 from US 60 (MP 0.0),East of Olive Hill extending North 0.30 miles providing access to West Carter Middle and High Schools and facilities.",Major Widening,Other Improvement Types,1,Carter,022-KY-1025  -000,0.0,0.3,Existing,-8.563427552,759,0.13522142525000014,-8.42820612675
42,173,43,1,Purchase ADD,IP20080031,,"Improve safety, access, and regional connectivity, and address geometric deficiencies from Hickman C/L to Cane Creek Bridge.",Reconstruction,Modernize Roadway-Rural,1,Hickman,053-US-0051  -000,0.0,2.4,Existing,-0.530082153,43,-7.923583707000001,-8.453665860000001
690,484,691,8,Lake Cumberland ADD,IP20080490,,"Realignment, lane widening and shouldering of KY-1649 from mp1.0 to near Popular Springs Road for development of future Air Port.",Reconstruction,Modernize Roadway-Rural,1,Casey,023-KY-1649  -000,1.0,3.281,Existing,-0.731776432,691,-7.739701300586194,-8.471477732586195
718,693,719,8,Lake Cumberland ADD,IP20150254,8-164,RECONSTRUCT CURVE ON US-127 AT DUNNVILLE. (02CCR)(04CCR) (10CCR)(12CCR),RECONSTRUCTION(O),Modernize Roadway-Rural,1,Casey,023-US-0127  -000,1.9,4.2,Existing,-4.067987941,719,-4.410472411157237,-8.478460352157237
923,946,924,12,Big Sandy ADD,IP20080703,12-281,CURVE REVISION AND PASSING LANES ON KY-194 NEAR DESKINS BRANCH (08CCR)(12CCR),SAFETY(P),Modernize Roadway-Rural,1,Pike,098-KY-0194  -000,21.3,22.0,Existing,0.09685902699999999,924,-8.681749661913457,-8.584890634913457
846,877,847,10,Kentucky River ADD,IP20150439,,RECONSTRUCTION OF KY 15 FROM BONNYMAN TO NEAR KY 28. (14CCN),Reconstruction,Modernize Roadway-Rural,1,Perry,097-KY-0015  -000,16.9,21.2,Existing,-24.64662196,847,16.050867512379718,-8.595754447620283
721,754,722,8,Lake Cumberland ADD,IP20150289,3-Aug,RECONSTRUCT BELL HILL FROM MP 10.4 TO MP 11.9.(12CCN)(16CCR)(18CCN),RECONSTRUCTION(O),Modernize Roadway-Rural,1,Casey,023-KY-0070  -000,10.4,11.9,Existing,-0.945639035,722,-7.775087382648622,-8.720726417648622
176,367,177,2,Green River ADD,IP20160021,2-197,IMPROVE CONNECTION BETWEEN US-60 AND CANNELTON BRIDGE APPROACH AT HAWESVILLE. (06CCR) (08CCR) (10CCR)(12CCR),RELOCATION(O),Construct Road in New Location,1,Hancock,046-KY-0069  -000,13.08,13.568,Existing,-7.409297587,177,-1.3696292719999998,-8.778926859
351,24,352,4,Lincoln Trail ADD,IP20150042,4-396.30,"ADDRESS SAFETY, MOBILITY, AND GEOMETRIC ISSUES ALONG US 150 IN WASHINGTON COUNTY FROM 0.7 MILES EAST OF GRUNDY HOME ROAD (MP 2.500) TO 600' EAST OF THE CARTWRIGHT CREEK BRIDGE (MP4.311). SECTION 2 (2016BOP)",RECONSTRUCTION(O),Modernize Roadway-Rural,1,Washington,115-US-0150  -000,2.5,6.557,Existing,-2.581260007,352,-6.304552921603539,-8.885812928603539
69,208,70,1,Purchase ADD,IP20160023,Jan-52,IMPROVE N 16TH STREET FROM KY 1327 (5 POINTS) TO KY 121. (16CCN),SAFETY(P),Modernize Roadway-Rural,1,Calloway,018-KY-0748  -000,0.0,0.307,Existing,-9.766384366,70,0.750681421,-9.015702945000001
269,50,270,3,Barren River ADD,IP20180057,3-80050,WIDEN US-79 TO 3 LANES FROM TODD COUNTY LINE TO INTERSECTION WITH RUSSELLVILLE BYPASS.(18CCN),MINOR WIDENING(O),Modernize Roadway-Rural,1,Logan,071-US-0079  -000,0.0,10.713,Existing,-14.83038029,270,5.799540299000013,-9.030839990999988
256,5,257,3,Barren River ADD,IP20150365,3-7030 / 3-7030 / 3-7030.50,RECONSTRUCT KY-259 FROM 0.42 MILE NORTH OF THE KY-70 INTERSECTION TO NORTH OF THE KYROCK ELEMENTARY SCHOOL (PRIORITY SECTION).  (2004BOPC),SPOT IMPROVEMENTS(O),Modernize Roadway-Rural,1,Edmonson,031-KY-0259  -000,12.095999999999998,16.204,Existing,1.777760066,257,-10.842706827934984,-9.064946761934983
491,651,492,5,Louisville-Southern Indiana (KIPDA) MPO,IP20160046,5-804,"RECONSTRUCT/WIDEN I-264 (WATTERSON EXPRESSWAY) FROM WESTPORT ROAD (KY-1447) TO I-71, INCLUDING THE US-42 INTERCHANGE AS A SPUI.(PROJECT INCLUDES 5-594) (12CCR)(14CCR)",RECONSTRUCTION(O),Innovative Interchange,9,Jefferson,056-I -0264  -871,0.0,0.273,Impacted,-9.112264504,0,0.0,-9.112264504
